{
  "$schema": "./schema.json",
  "id": "test-tracks",
  "label": "Test Tracks",
  "description": "Small test catalog for Track Select JSON loading.",
  "views": [
    {
      "id": "default",
      "label": "Default",
      "columns": [
        {
          "field": "trackType",
          "label": "Track Type"
        },
        {
          "field": "source",
          "label": "Source"
        }
      ],
      "grouping": ["trackType"],
      "leaf": "title"
    },
    {
      "id": "source",
      "label": "source",
      "columns": [
        {
          "field": "trackType",
          "label": "Track Type"
        },
        {
          "field": "source",
          "label": "Source"
        }
      ],
      "description": "description",
      "grouping": ["source"],
      "leaf": "title"
    }
  ],
  "tracks": [
    {
      "type": "bigwig",
      "id": "odnasd",
      "title": "DNase aggregate",
      "color": "#1B2021",
      "height": 50,
      "config": {
        "url": "https://downloads.wenglab.org/DNAse_All_ENCODE_MAR20_2024_merged.bw"
      },
      "metadata": {
        "trackType": "BigWig",
        "source": "ENCODE"
      }
    },
    {
      "type": "bigbed",
      "id": "example-bigbed",
      "title": "Example BigBed",
      "color": "#4b9560",
      "height": 60,
      "config": {
        "url": "YOUR_URL_HERE"
      },
      "metadata": {
        "trackType": "BigBed",
        "source": "Example"
      }
    }
  ]
}
